{
  "eventId": "00000000-0000-4000-8000-000000000004",
  "eventType": "EntitlementCompleted",
  "schemaVersion": 1,
  "occurredAt": "2026-10-09T00:00:00Z",
  "producer": "collaboration-service",
  "traceId": "11111111111111111111111111111111",
  "payload": {
    "userId": "00000000-0000-4000-8000-000000000002",
    "sagaId": "00000000-0000-4000-8000-000000000003",
    "generation": 1,
    "phase": "APPLY",
    "participant": "collaboration",
    "outcome": "APPLIED",
    "reason": "NONE"
  }
}
